{  
   "$schema":"http://json-schema.org/schema#",
   "required":[  
      "games",
      "range_end",
      "range_start",
      "total_games",
      "unique_users"
   ],
   "type":"object",
   "properties":{  
      "range_end":{  
         "type":"string"
      },
      "range_start":{  
         "type":"string"
      },
      "games":{  
         "items":{  
            "required":[  
               "added",
               "card_history",
               "coin",
               "duration",
               "hero",
               "hero_deck",
               "id",
               "legend",
               "mode",
               "note",
               "opponent",
               "opponent_deck",
               "rank",
               "region",
               "result",
               "user_hash"
            ],
            "type":"object",
            "properties":{  
               "note":{  
                  "type":"null"
               },
               "added":{  
                  "type":"string"
               },
               "hero":{  
                  "type":"string"
               },
               "region":{  
                  "type":"string"
               },
               "rank":{  
                  "type":[  
                     "integer",
                     "null"
                  ]
               },
               "legend":{  
                  "type":[  
                     "integer",
                     "null"
                  ]
               },
               "opponent_deck":{  
                  "type":[  
                     "null",
                     "string"
                  ]
               },
               "card_history":{  
                  "items":{  
                     "required":[  
                        "card",
                        "player",
                        "turn"
                     ],
                     "type":"object",
                     "properties":{  
                        "player":{  
                           "type":"string"
                        },
                        "card":{  
                           "required":[  
                              "id",
                              "mana",
                              "name"
                           ],
                           "type":"object",
                           "properties":{  
                              "mana":{  
                                 "type":[  
                                    "integer",
                                    "null"
                                 ]
                              },
                              "id":{  
                                 "type":"string"
                              },
                              "name":{  
                                 "type":"string"
                              }
                           }
                        },
                        "turn":{  
                           "type":"integer"
                        }
                     }
                  },
                  "type":"array"
               },
               "user_hash":{  
                  "type":"string"
               },
               "duration":{  
                  "type":[  
                     "integer",
                     "null"
                  ]
               },
               "hero_deck":{  
                  "type":[  
                     "null",
                     "string"
                  ]
               },
               "mode":{  
                  "type":"string"
               },
               "opponent":{  
                  "type":"string"
               },
               "coin":{  
                  "type":"boolean"
               },
               "id":{  
                  "type":"integer"
               },
               "result":{  
                  "type":"string"
               }
            }
         },
         "type":"array"
      },
      "unique_users":{  
         "type":"integer"
      },
      "total_games":{  
         "type":"integer"
      }
   }
}